{
  "id": "water",
  "category": "water",
  "defaultServingMl": 250,
  "caffeineMgPerServing": 0,
  "macrosPer100ml": {
    "energyKcal": 0,
    "proteinG": 0,
    "carbohydrateG": 0,
    "fatG": 0,
    "sugarsG": 0,
    "sodiumMg": 0
  },
  "hydrationFactor": 1.0,
  "hydrationFactorEstimated": false,
  "evidenceRefs": [
    {
      "kind": "doi",
      "id": "10.3945/ajcn.115.114769",
      "label": "Maughan et al. 2016 AJCN — Beverage Hydration Index",
      "supports": [
        "hydration_factor"
      ]
    }
  ],
  "notes": "Still water reference beverage (BHI = 1.0).",
  "nameKeys": {
    "enGB": "beverage.water.name",
    "uk": "beverage.water.name"
  }
}
