{
  "id": "semi-skimmed-milk",
  "category": "milk",
  "defaultServingMl": 200,
  "caffeineMgPerServing": 0,
  "macrosPer100ml": {
    "energyKcal": 47,
    "proteinG": 3.4,
    "carbohydrateG": 4.8,
    "fatG": 1.6,
    "sugarsG": 4.8,
    "sodiumMg": 43
  },
  "hydrationFactor": 1.54,
  "hydrationFactorEstimated": true,
  "evidenceRefs": [
    {
      "kind": "doi",
      "id": "10.3945/ajcn.115.114769",
      "label": "Maughan et al. 2016 AJCN — Beverage Hydration Index",
      "supports": [
        "hydration_factor"
      ]
    },
    {
      "kind": "database",
      "id": "usda-fdc",
      "label": "USDA FoodData Central (typical values per 100 ml / serving)",
      "supports": [
        "macros",
        "caffeine"
      ]
    }
  ],
  "notes": "Interpolated between Maughan full-fat (1.50) and skimmed (1.58).",
  "nameKeys": {
    "enGB": "beverage.semi_skimmed_milk.name",
    "uk": "beverage.semi_skimmed_milk.name"
  }
}
